movie_title,review
킹스맨: 시크릿 에이전트,첩보 장르에 영국 문화가 섞여 매력적으로 변함 코미디도 좋고 위트있는 첩보 액션 영화
킹스맨: 시크릿 에이전트,나를 비밀요원의 세계로
킹스맨: 시크릿 에이전트,뭐 더이상 할말이 있나.. 킹스맨은 최고
킹스맨: 시크릿 에이전트,B급 감성을 이렇게 세련되게 살릴 수 있는 영화라니.. 교회의 원테이크 씬과 후반부에 몰아치는 액션의 향연은 눈을 뗄 수가 없는 장관이었다.
킹스맨: 시크릿 에이전트,역시 1편이 재닜고 신선했다.
킹스맨: 시크릿 에이전트,킬링타임용~좋아요
킹스맨: 시크릿 에이전트,다소 어이없는 전개가 있긴 했지만 에그시라는 캐릭터 맘에 든다 판단능력도 신체능력도 좋고 무기사용도 잘함 총격씬 넘 재밌음
킹스맨: 시크릿 에이전트,B급 감성이 충만한 A급영화
킹스맨: 시크릿 에이전트,젠틀한 스파이가 잔인한 배경으로 웃음을 선사한다.
킹스맨: 시크릿 에이전트,화려한 액션 눈과 귀가 즐겁다
킹스맨: 시크릿 에이전트,"복잡한 세상과 온갖 골치거리는 뒤로하고 단순한 마음가짐으로 그저 즐기기만하면 모든 것이 완벽해지는 유쾌한 영화. 콜린 퍼스의 재발견, 그리고 태론 에저튼의 발견."
킹스맨: 시크릿 에이전트,역사를 왜 배우냐는 질문에 답하는 장면이 나오는 영화가 수도 없이 많은데 그걸 보고도 그냥 지나치는 자칭 영화광이 어떻게 이 영화를 보고 열광하지? 저스트 감독의 존경 고백 영화
킹스맨: 시크릿 에이전트,개인적으로 너무 재밌었던 액션코미디 스파이물
킹스맨: 시크릿 에이전트,유쾌함은 걸작을 만든다.
킹스맨: 시크릿 에이전트,미친듯이 쿨한 액션의 신세계
