movie_title,review
악마는 프라다를 입는다,"일과 사랑 사이에서 고민될 때 도움 될 만한, 참고서 같은 영화."
악마는 프라다를 입는다,덧없이 화려함 속에는 보이지 않는 스트레스가 뒤따르는 법.
악마는 프라다를 입는다,재밌다 재밌어
악마는 프라다를 입는다,"예쁘고 멋있고 자극되는, 매번 봐도 안 질리는 영화!"
악마는 프라다를 입는다,그건 그냥 블루가 아니야. 정확히 세룰린 블루야!
악마는 프라다를 입는다,메릴스트립 멋지다
악마는 프라다를 입는다,어떤 옷이 맞는지는 직접 입어봐야 아는 법
악마는 프라다를 입는다,"코미디인 줄 알았는데, 휴머니즘이었다."
악마는 프라다를 입는다,앤 헤서웨이 배우야 연기 잘하고 눈크고 예쁜것 다 알았지만 메릴 스트립님.............. 진짜 연기갓
악마는 프라다를 입는다,배우들의 연기가 명품이었던 영화.
악마는 프라다를 입는다,악마는 ...
악마는 프라다를 입는다,몇번을 봐도 질리지 않는 트렌디함
악마는 프라다를 입는다,프라다를 입는 사람은 앤디의 친구들. 이 영화에서 가장 이상하고 가장 무서운 사람은 앤디의 친구들임이 틀림없다. 그들이야말로 지옥에서온 악마다. 그치만 이 영화는 내 사골국물이지
악마는 프라다를 입는다,지금봐도 재미있는영화
악마는 프라다를 입는다,"누군가는 바쁘고, 누군가는 나쁘며, 누군가는 예쁘다."
악마는 프라다를 입는다,영어공부하려고 여러번 본영화. 이거 고른이유는 편안한 일상대화가 많고 다양한 연령대 대화 들을수 있고 OST 오프닝때 너무 좋다.
악마는 프라다를 입는다,미란다와 에밀리의 밀당 사랑스러운 영화
악마는 프라다를 입는다,여자가 봐도 메릴스트립에게 반하겠음
악마는 프라다를 입는다,언제쯤 촌스러워 보일까?
악마는 프라다를 입는다,아무것도 모르고 입사해서 초짜가 울분을토하다 작정하고 적응해 나가는 우리의 사회 초년생 모습이 보여 응원하는 마음으로 보게되는 영화
악마는 프라다를 입는다,신입이 사회생활을 헤처나갈때 저런 편집장 스타일을 만나게 돼있음. 슬기롭게 풀어가는 게 답
악마는 프라다를 입는다,패션과 비즈니스에 대한 주인공의 성장 영화. 화려한 옷들과 배우진에 감탄만이 남았다
악마는 프라다를 입는다,입금전.입금후 변화는 당연한 시장논리
악마는 프라다를 입는다,소신껏 살자
악마는 프라다를 입는다,아 뭔가뭔가 아쉽다..
악마는 프라다를 입는다,소설이랑 영화랑 느낌이 비슷하면서도 다르네
악마는 프라다를 입는다,삶의 길엔 많은 결정권들이 있는데 진정 내가 무엇을 원하며 포기를 하더라도 뭘 포기할 것인지를 정하고 살자.
악마는 프라다를 입는다,역시나 역작. 그러나 시대 감성이 제법 강한.
악마는 프라다를 입는다,"꿈, 열정과 현실 초월"
악마는 프라다를 입는다,카리스마를 뽐내는 노회한 마녀.
악마는 프라다를 입는다,멋진 여자가 좋다
악마는 프라다를 입는다,재미있게 봤어요
악마는 프라다를 입는다,제목이 유명해서 봤음 그것 뿐
악마는 프라다를 입는다,메릴 스트립이 찰떡같이 소화해낸 악마
악마는 프라다를 입는다,"에밀리 파리에 가다 다음 시즌을 기다리다 생각나 다시본 영화, 다시봐도 재미있고 세련됐다. 다시 태어난다면 앤 해서웨이로 태어나고 싶을만큼 그녀는 너무 사랑스럽고 예쁘다."
악마는 프라다를 입는다,"생각보다 기억에서 쉽게 잊혀질, 흘려야할 것이 많은 영화. 그래도 적당한 교훈과 지혜 혹은 배워야할 것이 있긴 하다."
